{
  "$schema": "https://json-schema.org/draft/2020-12/schema",
  "$id": "https://hypereikon.online/schemas/inside-valdivia-live-materialization-gate-1.json",
  "type": "object",
  "required": ["schema", "source_locks", "runtime_profiles", "workspace_gate", "stop_conditions", "phases"],
  "properties": {
    "schema": {"const": "inside-valdivia.live-materialization-gate/1"},
    "source_locks": {"type": "object"},
    "runtime_profiles": {"type": "object"},
    "workspace_gate": {"type": "object"},
    "stop_conditions": {"type": "array", "minItems": 1, "items": {"type": "string", "minLength": 1}},
    "phases": {"type": "array", "minItems": 1, "items": {"type": "object"}}
  },
  "additionalProperties": false
}
