{
  "schema": "inside-valdivia.live-materialization-gate/1",
  "source_locks": {
    "cauce_commit": "c83cb162e39b6594c371b445af70388d9db892b4",
    "runtime_commit": "6751b8fd90b02ef871bc046f228b83b004871d3a",
    "workspace_commit": "65d6612d1cbeae3e35c664873a2aa1088ac3e7d2",
    "repository_control_commit": "49d50644173c62d74b799099fee2a2eddbfdf642",
    "model_control_commit": "2b4b3a79c796b53a4504536b971b3f632ed762bb"
  },
  "runtime_profiles": {
    "core": "runtime/requirements/h3-core.json",
    "full": "runtime/requirements/h3-full.json",
    "control": "runtime/requirements/h3-control-experimental.json",
    "learned_upscale": "runtime/requirements/h3-learned-upscale-experimental.json"
  },
  "workspace_gate": {
    "required_diagnostic_schema": "comfy.workspace-diagnostic/1",
    "required_export_schema": "comfy.workspace-export/2",
    "required_workspace_control_version": "0.4.2",
    "required_methods": [
      "inventory",
      "planOpenExact",
      "openExact",
      "planCloseOwned",
      "closeExact",
      "loadUiGraph",
      "loadApiGraph",
      "exportActive"
    ],
    "required_ready": true,
    "maximum_active_agent_graphs": 1
  },
  "stop_conditions": [
    "The queue is not idle.",
    "The full runtime manifest cannot validate its own content hashes.",
    "A required node or model is missing.",
    "Free storage is below the declared reserve.",
    "The active workflow identity or signature is ambiguous.",
    "A submitted prompt id has an unknown outcome; resume or inspect it instead of resubmitting.",
    "A custom-node installation journal is outcome-unknown or still requires a host-side partial-directory check."
  ],
  "phases": [
    {
      "id": "official-keyframed-baselines",
      "runtime_profile": "core",
      "topology_keys": [
        "generate.keyframed@text-only",
        "generate.keyframed@first-frame",
        "generate.keyframed@last-frame",
        "generate.keyframed@first-last"
      ]
    },
    {
      "id": "official-reference-and-guide-baselines",
      "runtime_profile": "full",
      "topology_keys": [
        "generate.from_references@image-reference-match",
        "generate.from_references@video-reference",
        "generate.with_guides@single-anchor",
        "generate.with_guides@guide-clip"
      ]
    },
    {
      "id": "native-state-and-assembly-baselines",
      "runtime_profile": "full",
      "topology_keys": [
        "continue.native_av@keyframe-overlap",
        "continue.native_av@masked-overlap",
        "complete.native_av@two-sided-infill",
        "complete.native_av@local-replacement",
        "rollback.native_av@branch-suffix",
        "frames.assemble@ordered-concatenation"
      ]
    },
    {
      "id": "dependent-variants",
      "runtime_profile": "full",
      "topology_keys": [
        "generate.from_references@image-reference-max",
        "generate.with_guides@multi-anchor",
        "continue.native_av@masked-overlap-future-guide",
        "complete.native_av@backward-prefix",
        "complete.native_av@two-source-connection",
        "generate.from_references@video-reference-with-guide",
        "generate.with_guides@first-last-interior"
      ]
    },
    {
      "id": "native-masked-editing-and-outpaint",
      "runtime_profile": "full",
      "topology_keys": [
        "edit.masked_video@static-spatial",
        "edit.masked_video@local-retake",
        "reframe.outpaint_video@centered",
        "edit.masked_video@animated-spatiotemporal",
        "reframe.outpaint_video@offset"
      ]
    },
    {
      "id": "bounded-refinement-characterization",
      "runtime_profile": "full",
      "topology_keys": [
        "refine.video@full-frame",
        "refine.video@masked"
      ]
    },
    {
      "id": "native-temporal-densification",
      "runtime_profile": "full",
      "topology_keys": [
        "densify.temporal@token-inpaint"
      ]
    },
    {
      "id": "native-spatial-regeneration",
      "runtime_profile": "full",
      "topology_keys": [
        "regenerate.spatial@latent-second-pass",
        "regenerate.spatial@pixel-vae-second-pass",
        "regenerate.spatial@tiled-pixel-vae"
      ]
    },
    {
      "id": "official-structural-control",
      "runtime_profile": "control",
      "topology_keys": [
        "generate.with_control@structural-video",
        "generate.with_control@masked-inpaint"
      ]
    },
    {
      "id": "learned-spatial-regeneration",
      "runtime_profile": "learned_upscale",
      "topology_keys": [
        "regenerate.spatial@learned-latent-second-pass"
      ]
    }
  ]
}
